"Status","Start Time","Stop Time","Duration in ms","Parent Suite","Suite","Sub Suite","Test Class","Test Method","Name","Description"
"passed","Fri Jul 05 00:25:04 GMT 2024","Fri Jul 05 00:25:28 GMT 2024","24296","chromium","","Billing","","","TC_14_57_01 | Verify that user can upgrade subscription (from Monthly to Annually)","Objective: Verify that a user can successfully upgrade their subscription from a monthly plan to an annual plan."
"passed","Fri Jul 05 00:16:55 GMT 2024","Fri Jul 05 00:17:18 GMT 2024","23201","chromium","","Company","","","TC_10_43_01 | Verify that the business user can fill company's form","To verify the process of filling company form."
"passed","Thu Jul 04 23:43:25 GMT 2024","Thu Jul 04 23:43:46 GMT 2024","21125","chromium","","Registration","","","TC_01_03_01 | Verify successful registration of Personal user with Annually subscription","To verify that a Personal user can successfully register."
"passed","Thu Jul 04 23:56:41 GMT 2024","Thu Jul 04 23:57:26 GMT 2024","45250","chromium","","DocumentsType","","","TC_05_16_01 | Verify the user receives an email reminder to sign the document","Objective: To verify that the user can send a reminder through the user interface."
"passed","Thu Jul 04 23:43:46 GMT 2024","Thu Jul 04 23:43:49 GMT 2024","2903","chromium","","Authorization","","","TC_02_05_01 | Verify successful login and the user directed to the sign page","Objective: To verify the process of logging a user into their account."
"passed","Fri Jul 05 00:22:52 GMT 2024","Fri Jul 05 00:23:17 GMT 2024","24841","chromium","","Settings: Edit signature","","","TC_13_52_01 | Verify that user can edit Signature.","Verify that user can delete our Signature."
"passed","Fri Jul 05 00:08:27 GMT 2024","Fri Jul 05 00:08:59 GMT 2024","32151","chromium","","Forms","","","TC_08_32_01 | Verify that user can create form","Verify that user can create form"
"passed","Fri Jul 05 00:26:49 GMT 2024","Fri Jul 05 00:26:55 GMT 2024","5891","chromium","","Out of scope. Tests to maintain New User Creation.","","","Create Free User",""
"passed","Thu Jul 04 23:59:20 GMT 2024","Fri Jul 05 00:00:01 GMT 2024","40936","chromium","","DocumentsType","","","TC_05_19_01 | Verify that deleted document has been moved to the trash by using ACTIONS_options dropdown menu and then deleted permanently","To verify the process of moving the document to the trash and then deleting document permanently."
"passed","Fri Jul 05 00:15:13 GMT 2024","Fri Jul 05 00:16:01 GMT 2024","48029","chromium","","Team","","","TC_09_39_02 | Verify that Business User can downgrade an ""Admin"" team member to ""User""","Objective: To verify that Business User can downgrade an ""Admin"" team member to ""User"""
"passed","Fri Jul 05 00:06:54 GMT 2024","Fri Jul 05 00:07:40 GMT 2024","46300","chromium","","Templates","","","TC_07_30_01 | Verify that user can duplicate template","Objective: To verify the process of duplicate template."
"passed","Thu Jul 04 23:55:59 GMT 2024","Thu Jul 04 23:56:41 GMT 2024","41713","chromium","","DocumentsType","","","TC_05_18_01 | Verify moving a document to a folder","To verify the process of moving a document into a folder."
"passed","Fri Jul 05 00:20:02 GMT 2024","Fri Jul 05 00:20:23 GMT 2024","21002","chromium","","API key","","","TC_12_48_01 | Copy API key created by the ""Create API"" button on the right.","To verify that user can copy API key created by the ""Create API"" button on the right."
"passed","Thu Jul 04 23:55:08 GMT 2024","Thu Jul 04 23:55:59 GMT 2024","51634","chromium","","DocumentsType","","","TC_05_21_02 | Verify that button ""Revert to Draft"" is active","Objective: To verify that the document can be returned for editing."
"passed","Fri Jul 05 00:17:45 GMT 2024","Fri Jul 05 00:18:15 GMT 2024","29577","chromium","","Profile","","","TC_11_45_01 | Verify that User can change password","Objective: To verify that the User can change a password and login with a new password"
"passed","Fri Jul 05 00:26:17 GMT 2024","Fri Jul 05 00:26:49 GMT 2024","31662","chromium","","","","","Verify that Email message received",""
"passed","Fri Jul 05 00:19:11 GMT 2024","Fri Jul 05 00:19:39 GMT 2024","28650","chromium","","Profile","","","TC_11_46_03 | Verify user can enabling, disabling checkboxes","Objective: To verify that the User can enabling, disabling checkboxes"
"passed","Thu Jul 04 23:49:10 GMT 2024","Thu Jul 04 23:50:34 GMT 2024","84300","chromium","","Sign Document","","","TC_04_14_01 | Verify adding users who can view the document","To verify the adding viewers / adding users who can view the document."
"passed","Thu Jul 04 23:50:34 GMT 2024","Thu Jul 04 23:51:23 GMT 2024","48498","chromium","","Sign Document","","","TC_04_10_01 | Verify sign document as myself","Objective: To verify sign document as myself"
"passed","Thu Jul 04 23:47:00 GMT 2024","Thu Jul 04 23:47:51 GMT 2024","50758","chromium","","CreateDocument","","","TC_03_07_05 | Verify that user can sign a document themselves with Initial","Objective: Verify that user can sign a document themselves with Initial"
"passed","Fri Jul 05 00:20:23 GMT 2024","Fri Jul 05 00:20:45 GMT 2024","21263","chromium","","API key","","","TC_12_48_02 | Verify User can copy API key created by the ""Create API"" button in Table.","To verify that user can copy API key created by the ""Create API"" button in Table."
"passed","Fri Jul 05 00:18:15 GMT 2024","Fri Jul 05 00:18:36 GMT 2024","21554","chromium","","Profile","","","TC_11_47_01 | Verify that user can delete account","Objective: To verify that the User can delete account"
"passed","Thu Jul 04 23:43:04 GMT 2024","Thu Jul 04 23:43:25 GMT 2024","21186","chromium","","Registration","","","TC_01_03_01 | Verify successful registration of Personal user with Monthly subscription","To verify that a Personal user can successfully register."
"passed","Fri Jul 05 00:04:34 GMT 2024","Fri Jul 05 00:05:12 GMT 2024","38026","chromium","","Templates","","","TC_07_27_01 | Verify that user can create a template","Objective: To verify that the user can create a new template in the system successfully. This includes ensuring that all required fields are completed correctly, the template is saved, and it is accessible for future use."
"passed","Fri Jul 05 00:02:54 GMT 2024","Fri Jul 05 00:03:32 GMT 2024","38371","chromium","","Folders","","","TC_06_25_01 | Move folder to folder","To verify the user can move folder to folder"
"passed","Thu Jul 04 23:42:47 GMT 2024","Thu Jul 04 23:43:04 GMT 2024","17268","chromium","","Registration","","","TC_01_02_01 | Verify successful registration of Free user","To verify that a Free user can successfully register."
"passed","Thu Jul 04 23:51:23 GMT 2024","Thu Jul 04 23:52:04 GMT 2024","40753","chromium","","Sign Document","","","TC_04_10_02 | Verify that the user who uploaded the document and other signer can sign it","Objective: To verify that the user who uploaded the document and Other Signer can sign it"
"passed","Thu Jul 04 23:53:20 GMT 2024","Thu Jul 04 23:54:22 GMT 2024","62467","chromium","","Sign Document","","","TC_04_12_01 | Verify that signer can decline signature","Objective: To verify that signer can decline signature"
"passed","Fri Jul 05 00:26:55 GMT 2024","Fri Jul 05 00:27:14 GMT 2024","19286","chromium","","Out of scope. Tests to maintain New User Creation.","","","Create Business User",""
"passed","Fri Jul 05 00:17:18 GMT 2024","Fri Jul 05 00:17:45 GMT 2024","26898","chromium","","Company","","","TC_10_43_02 | Verify that the business user can fill company's form with checkboxes","To verify the process of filling company form with checkboxes."
"passed","Fri Jul 05 00:21:34 GMT 2024","Fri Jul 05 00:22:06 GMT 2024","32139","chromium","","API key","","","TC_12_49_01 | Purchase Titanium API plan","Objective: Verify that the user can successfully purchase an API plan"
"passed","Fri Jul 05 00:22:29 GMT 2024","Fri Jul 05 00:22:52 GMT 2024","23044","chromium","","Settings: Edit signature","","","TC_13_53_01 | Verify that user can delete Signature.","Verify that user can delete our Signature."
"passed","Fri Jul 05 00:05:56 GMT 2024","Fri Jul 05 00:06:54 GMT 2024","57599","chromium","","Templates","","","TC_07_28_01 | Verify that user can edit template","Objective: To verify that a user can successfully edit an existing template by changing its name, message, role, and associated document, and ensure that the changes are reflected in the user interface and confirmed by appropriate toast messages."
"passed","Fri Jul 05 00:07:40 GMT 2024","Fri Jul 05 00:08:27 GMT 2024","46519","chromium","","Templates","","","TC_07_29_01 | Verify that the user can delete the template","Objective: Verify that the user can successfully delete a template."
"passed","Fri Jul 05 00:13:37 GMT 2024","Fri Jul 05 00:14:25 GMT 2024","48218","chromium","","Team","","","TC_09_38_01 | Verify that Business User can add Admin team member","Objective: Verify that Business User can add Admin team member"
"passed","Fri Jul 05 00:02:18 GMT 2024","Fri Jul 05 00:02:54 GMT 2024","35946","chromium","","Folders","","","TC_06_23_01 | Rename folder","Objective: Testing Folder Renaming Functionality."
"passed","Thu Jul 04 23:43:49 GMT 2024","Thu Jul 04 23:44:48 GMT 2024","58269","chromium","","CreateDocument","","","TC_03_07_01 | Sign a document - verify that user can sign a document themselves","Objective: To verify the process of creating and signing a document"
"passed","Fri Jul 05 00:25:28 GMT 2024","Fri Jul 05 00:25:51 GMT 2024","22804","chromium","","Billing","","","TC_14_58_01 | Verify the ability to successfully cancel subscription","Objective: Verify that users can successfully cancel their subscription."
"passed","Fri Jul 05 00:12:44 GMT 2024","Fri Jul 05 00:13:37 GMT 2024","52829","chromium","","Team","","","TC_09_38_01 | Verify that Business User can add User team member","Objective: Verify that Business User can add User team member"
"passed","Thu Jul 04 23:42:10 GMT 2024","Thu Jul 04 23:42:34 GMT 2024","23402","chromium","","Registration","","","TC_01_01_01 | Verify successful registration of Trial user","To verify that a Trial user can successfully register."
"passed","Thu Jul 04 23:57:26 GMT 2024","Thu Jul 04 23:58:13 GMT 2024","46888","chromium","","DocumentsType","","","TC_05_21_03 | Verify that document_status is  Draft","Objective: To verify that the document can be returned for editing."
"passed","Fri Jul 05 00:24:12 GMT 2024","Fri Jul 05 00:25:04 GMT 2024","52138","chromium","","Billing","","","TC_14_54_01 | Attach/delete payment card","Objective: To verify the functionality of attaching a payment card through the settings-billing section and deleting a payment card through the Billing Portal."
"passed","Fri Jul 05 00:11:24 GMT 2024","Fri Jul 05 00:12:44 GMT 2024","79717","chromium","","Forms","","","TC_08_33_01 | Verify that user can edit form",""
"passed","Fri Jul 05 00:23:17 GMT 2024","Fri Jul 05 00:23:39 GMT 2024","21625","chromium","","Billing","","","TC_14_57_02 | Verify the ability to successfully downgrade subscription","Objective: To verify the functionality of downgrade subscription."
"passed","Thu Jul 04 23:47:51 GMT 2024","Thu Jul 04 23:48:40 GMT 2024","49212","chromium","","CreateDocument","","","TC_03_07_04 | Verify that user can sign a document themselves with existed signature","Objective: To verify the process of creating and signing a document with an existing signature"
"passed","Thu Jul 04 23:46:17 GMT 2024","Thu Jul 04 23:47:00 GMT 2024","43832","chromium","","CreateDocument","","","TC_03_07_02 | Verify that the user who uploaded the document and Other Signer can sign it","Objective: To verify the process of creating, signing, and sending a document to another signer."
"passed","Fri Jul 05 00:23:39 GMT 2024","Fri Jul 05 00:23:55 GMT 2024","16562","chromium","","Billing","","","TC_14_56_01 | Verify successful upsell of users subscription Personal plan","Objective: Verify that free users can successfully upgrade their subscription plan.
"
"passed","Thu Jul 04 23:45:32 GMT 2024","Thu Jul 04 23:46:17 GMT 2024","44739","chromium","","CreateDocument","","","TC_03_07_03 | Verify user can create document and send it for signature","Objective: To verify the process of creating and sending a document for signature."
"passed","Fri Jul 05 00:10:27 GMT 2024","Fri Jul 05 00:11:24 GMT 2024","57727","chromium","","Forms","","","TC_08_34_01 | Verify that user can delete form","Verify that user can delete form"
"passed","Fri Jul 05 00:14:25 GMT 2024","Fri Jul 05 00:15:13 GMT 2024","48342","chromium","","Team","","","TC_09_39_01 | Verify that Business User can upgrade a ""User"" team member to ""Admin""","Objective: To verify that Business User can upgrade a ""User"" team member to ""Admin"""
"passed","Fri Jul 05 00:05:12 GMT 2024","Fri Jul 05 00:05:56 GMT 2024","44509","chromium","","Templates","","","TC_07_31_01 | Verify that  the user can select Add to API","Objective: To verify the process of add template to API."
"passed","Fri Jul 05 00:25:51 GMT 2024","Fri Jul 05 00:26:04 GMT 2024","13020","chromium","","Billing","","","TC_14_55_01 | Verify the ability to successfully select a subscription Personal plan","Objective: Verify that free users can successfully upgrade their subscription plan."
"passed","Thu Jul 04 23:52:48 GMT 2024","Thu Jul 04 23:53:20 GMT 2024","32236","chromium","","Sign Document","","","TC_04_11_02 | Verify custom signing order between others customers","To verify custom signing order between others customers"
"passed","Fri Jul 05 00:08:59 GMT 2024","Fri Jul 05 00:09:43 GMT 2024","43685","chromium","","Forms","","","TC_08_35_01 | Verify that user can duplicate form","Verify that user can duplicate form"
"passed","Fri Jul 05 00:09:43 GMT 2024","Fri Jul 05 00:10:26 GMT 2024","43797","chromium","","Forms","","","TC_08_36_01 | Verify that user can disable and enable form","Verify that user can duplicate form"
"passed","Thu Jul 04 23:48:40 GMT 2024","Thu Jul 04 23:49:10 GMT 2024","29598","chromium","","Sign Document","","","TC_04_11_01 | Verify custom signing order","To verify custom signing order"
"passed","Fri Jul 05 00:19:39 GMT 2024","Fri Jul 05 00:20:02 GMT 2024","23022","chromium","","Profile","","","TC_11_46_01 | Verify the user can upload and delete the profile picture","Objective: To verify the user can upload, delete the profile picture"
"passed","Fri Jul 05 00:21:09 GMT 2024","Fri Jul 05 00:21:34 GMT 2024","24842","chromium","","API key","","","TC_12_49_01 | Purchase Platinum API plan","Objective: Verify that the user can successfully purchase an API plan"
"passed","Fri Jul 05 00:00:01 GMT 2024","Fri Jul 05 00:01:28 GMT 2024","87604","chromium","","DocumentsType","","","TC_05_20_01 | Verify that Business User can download a ""Completed"" document (API)","Objective: Verify that Business User can download a ""Completed"" document (API)"
"passed","Fri Jul 05 00:18:36 GMT 2024","Fri Jul 05 00:19:11 GMT 2024","34457","chromium","","Profile","","","TC_11_44_01 | Verify User can change email","Objective: To verify that the User can change a email."
"passed","Fri Jul 05 00:26:04 GMT 2024","Fri Jul 05 00:26:17 GMT 2024","13105","chromium","","Billing","","","TC_14_55_01 | Verify the ability to successfully select a subscription Business plan","Objective: Verify that free users can successfully upgrade their subscription plan."
"passed","Fri Jul 05 00:22:06 GMT 2024","Fri Jul 05 00:22:29 GMT 2024","23058","chromium","","Settings: Edit signature","","","TC_13_51_01 | Verify that user can create Signature","Verify that the user can create a Signature."
"passed","Fri Jul 05 00:20:45 GMT 2024","Fri Jul 05 00:21:09 GMT 2024","24376","chromium","","API key","","","TC_12_49_01 | Purchase Gold API plan","Objective: Verify that the user can successfully purchase an API plan"
"passed","Thu Jul 04 23:54:22 GMT 2024","Thu Jul 04 23:55:08 GMT 2024","45332","chromium","","DocumentsType","","","TC_05_21_01 | Verify that button Edit&Resend is active","Objective: To verify that the document can be returned for editing."
"passed","Fri Jul 05 00:01:28 GMT 2024","Fri Jul 05 00:01:49 GMT 2024","20964","chromium","","Folders","","","TC_06_22_01 | Verify the business user can create folder","Objective: To verify the user can create the folder"
"passed","Thu Jul 04 23:58:13 GMT 2024","Thu Jul 04 23:59:20 GMT 2024","66681","chromium","","DocumentsType","","","TC_05_17_01 | Share document","Objective: To verify that the document can be Share."
"passed","Fri Jul 05 00:01:49 GMT 2024","Fri Jul 05 00:02:18 GMT 2024","28829","chromium","","Folders","","","TC_06_24_01 | Verify the business user can delete folder","Objective: To verify the user can delete the folder"
"passed","Thu Jul 04 23:44:48 GMT 2024","Thu Jul 04 23:45:32 GMT 2024","44205","chromium","","CreateDocument","","","TC_03_07_06 | Verify user can create, sign, and send a document to another signer","Objective: To verify the process of creating, signing, and sending a document to another signer."
"passed","Fri Jul 05 00:16:01 GMT 2024","Fri Jul 05 00:16:55 GMT 2024","53690","chromium","","Team","","","TC_09_40_01 | Verify that Business User can remove ""User"" teammate from Team","Objective: To verify that Business User can remove ""User"" teammate from Team"
"passed","Fri Jul 05 00:23:55 GMT 2024","Fri Jul 05 00:24:12 GMT 2024","16602","chromium","","Billing","","","TC_14_56_01 | Verify successful upsell of users subscription Business plan","Objective: Verify that free users can successfully upgrade their subscription plan.
"
"passed","Thu Jul 04 23:52:04 GMT 2024","Thu Jul 04 23:52:48 GMT 2024","43995","chromium","","Sign Document","","","TC_04_13_01 | Verify the document's expiration date","Objective: Verify that changing the document status to ""expired""(database) updates the front-end display"
